"Inglés","Español"
"5 Ingredient Blueberry Protein Muffins","Muffins de Proteína con Arándanos y 5 Ingredientes"
"Air Fryer Crisp Egg Cups","Tazas de Huevo Crujientes en Freidora de Aire"
"Almond, Wild Blueberry, And Flax Smoothie","Batido de Almendra, Arándanos Silvestres y Linaza"
"Apple-Walnut French Toast","Tostadas Francesas de Manzana y Nuez"
"Apple Pie Yogurt Parfait","Parfait de Yogur con Pastel de Manzana"
"Apple Walnut French Toast (Cloud Bread)","Tostadas Francesas de Manzana y Nuez (Pan de Nube)"
"Asparagus and Bok Choy Frittata","Frittata de Espárragos y Bok Choy"
"Asparagus and Bok Choy Frittata","Frittata de Espárragos y Bok Choy"
"Asparagus Frittata","Frittata de Espárragos"
"Avocado Egg Pizza","Pizza de Aguacate y Huevo"
"Avocado Toast with Turkey Bacon and Tomato","Tostada de Aguacate con Tocino de Pavo y Tomate"
"Baked Egg 'n' Tomato Cups","Tazas de Huevo y Tomate al Horno"
"Baked Egg with Avocado, Tomato, and Citrus Salad","Huevo al Horno con Aguacate, Tomate y Ensalada de Cítricos"
"Baked Pumpkin Oatmeal","Avena al Horno con Calabaza"
"Banana Chocolate Chip Mini Muffins","Mini Muffins de Banana y Chispas de Chocolate"
"Berry Almond Oatmeal","Avena con Frutas del Bosque y Almendra"
"Big Skillet Breakfast","Desayuno Grande en Sartén"
"Blanco Huevos Rancheros","Huevos Rancheros Blancos"
"Blueberry Almond Pancakes","Panqueques de Almendra y Arándanos"
"Blueberry Green Tea Smoothie","Batido de Té Verde y Arándanos"
"Blueberry Lemon Yogurt Parfait","Parfait de Yogur con Arándanos y Limón"
"Blueberry Sauce","Salsa de Arándanos"
"Blueberry Yogurt Lemon Bars","Barras de Yogur, Arándanos y Limón"
"Breakfast Cookies","Galletas de Desayuno"
"Breakfast Egg and Ham Burrito","Burrito de Desayuno con Huevo y Jamón"
"Breakfast Pizza","Pizza de Desayuno"
"Breakfast Pizza","Pizza de Desayuno"
"Breakfast Quesadilla","Quesadilla de Desayuno"
"Brown Rice Congee with Stir-Fried Herbs","Congee de Arroz Integral con Hierbas Salteadas"
"Budget-Friendly Chicken Sausage Hash","Hash de Salchicha de Pollo Económico"
"Budget-Friendly Egg, Ham and Spinach Sandwich","Sándwich Económico de Huevo, Jamón y Espinaca"
"Budget-Friendly Summer Vegetable Frittata","Frittata Económica de Verduras de Verano"
"Cheesy Savory Oatmeal","Avena Salada con Queso"
"Cheesy Savory Oatmeal","Avena Salada con Queso"
"Chia Seed Falooda","Falooda de Semillas de Chía"
"Cinnamon French Vanilla Overnight Oats","Avena Nocturna de Canela y Vainilla Francesa"
"Cranberry Almond Muffins","Muffins de Arándanos y Almendra"
"Crustless Asparagus & Pepper Mini Quiche","Mini Quiche sin Corteza de Espárragos y Pimientos"
"Crustless Asparagus and Tomato Quiche","Quiche sin Corteza de Espárragos y Tomate"
"Crustless Mediterranean Quiche","Quiche Mediterránea sin Corteza"
"Crustless Spinach and Mushroom Quiche","Quiche sin Corteza de Espinaca y Champiñones"
"Double-Duty Banana Pancakes","Panqueques de Banana Doble"
"Easy Egg Muffins","Muffins de Huevo Fáciles"
"Easy Egg Salad","Ensalada de Huevo Fácil"
"Eggs Benedict Florentine","Huevos Benedict Florentino"
"Eggs Benedict with Silken Hollandaise Sauce","Huevos Benedict con Salsa Holandesa Sedosa"
"Eggs Drowned in Salsa Verde","Huevos Ahogados en Salsa Verde"
"Egg and Avocado Toasts","Tostadas de Huevo y Aguacate"
"Egg and Veggie Casserole","Cazuela de Huevo y Verduras"
"Egg Souffle","Soufflé de Huevo"
"Fall Granola with Pumpkin Seeds","Granola de Otoño con Semillas de Calabaza"
"Farmers’ Market Omelets","Omelets del Mercado de Agricultores"
"Fried Egg And Avocado Sandwiches","Sándwiches de Huevo Frito y Aguacate"
"Fruit-Filled Pancake Puffs","Bombas de Panqueque Rellenas de Frutas"
"Fruit and Almond Smoothie","Batido de Frutas y Almendra"
"Ginger Infused Oatmeal","Avena Infundida con Jengibre"
"Ginger Infused Oatmeal","Avena Infundida con Jengibre"
"Gluten-Free Banana Bread","Pan de Banana sin Gluten"
"Gluten-Free Blueberry Corn Muffins","Mini Muffins de Maíz y Arándanos sin Gluten"
"Gluten-Free Parmesan Biscuits","Galletas de Parmesano sin Gluten"
"Good Morning Power Parfait","Parfait Energético de Buenos Días"
"Green Smoothie Bowl","Tazón de Batido Verde"
"Green Vegetable Egg \"Tortilla\"","\"Tortilla\" de Huevo con Verduras Verdes"
"Guilt-Free Breakfast Sausage Patties","Pasteles de Salchicha de Desayuno Saludables"
"Ham and Broccoli Frittata","Frittata de Jamón y Brócoli"
"Hard Boiled Egg","Huevo Duro"
"Herbed Soft Scrambled Eggs on Toast","Huevos Revueltos Suaves con Hierbas sobre Tostada"
"High-Fiber Zucchini Muffins","Muffins de Calabacín Altos en Fibra"
"Homemade Fruit-Sweetened Granola","Granola Casera Endulzada con Frutas"
"Huevos Rancheros","Huevos Rancheros"
"Huevos Rancheros with Pinto Beans, Brown Rice and Chicken Sausage","Huevos Rancheros con Frijoles Pinto, Arroz Integral y Salchicha de Pollo"
"Ingrid Hoffmann's Quinoa and Beans Casamiento","Casamiento de Quinoa y Frijoles de Ingrid Hoffmann"
"Instant Pot Chia Berry Crepes","Crepes de Chía y Frutas del Bosque en Instant Pot"
"Instant Pot Individual Egg and Vegetable Frittatas","Frittatas Individuales de Huevo y Verduras en Instant Pot"
"Instant Pot Lentils and Poached Eggs","Lentejas y Huevos Escalfados en Instant Pot"
"Italian Sausage Frittata","Frittata de Salchicha Italiana"
"Just Peachy Yogurt and Granola Jar","Frasco de Yogur y Granola de Durazno"
"Light And Fluffy Spinach And Cheese Strata","Strata Ligera y Esponjosa de Espinaca y Queso"
"Low Carb Apple Spice Muffins","Muffins de Manzana y Especias Bajos en Carbohidratos"
"Luscious Avocado-Strawberry Salad With Toasted Pine Nuts","Ensalada Deliciosa de Aguacate y Fresa con Piñones Tostados"
"Maple Apples","Manzanas con Jarabe de Arce"
"Mashed Sweet Potato Breakfast Bowl","Tazón de Desayuno con Puré de Batata"
"Mashed Sweet Potato Breakfast Bowl","Tazón de Desayuno con Puré de Batata"
"Meat Lover's Breakfast Cups","Tazas de Desayuno para Amantes de la Carne"
"Mexican Skillet Egg Casserole","Cazuela de Huevo Mexicana en Sartén"
"Microwave Egg and Veggie Jars","Frascos de Huevo y Verduras en Microondas"
"Milk Chocolate Peanut Butter Banana Smoothie","Batido de Banana, Mantequilla de Cacahuate y Chocolate con Leche"
"Millet Pancakes with Lentil Puree","Panqueques de Mijo con Puré de Lentejas"
"Mini Vegetable Frittata","Mini Frittata de Verduras"
"Mini Veggie Frittatas","Mini Frittatas de Verduras"
"Nuts about Pizza for Breakfast","Amantes de la Pizza para el Desayuno"
"Oatmeal Congee","Congee de Avena"
"Oatmeal Pecan Pancakes","Panqueques de Avena y Pacanas"
"Oat Bran Muffins","Muffins de Salvado de Avena"
"Oat Bran Pancakes","Panqueques de Salvado de Avena"
"OK Oatmeal with Strawberries and Almonds","Avena OK con Fresas y Almendras"
"Omelet de Verduras","Omelet de Verduras"
"Onion, Shallot and Herb Frittata","Frittata de Cebolla, Chalota y Hierbas"
"Peach & Cream Smoothie","Batido de Durazno y Crema"
"Peach & Cream Smoothie","Batido de Durazno y Crema"
"Peanut Butter Banana Oat Bites","Bocaditos de Avena con Mantequilla de Cacahuate y Banana"
"Power Granola","Granola Energética"
"Pumpkin-Banana Muffins","Muffins de Calabaza y Banana"
"Pumpkin-Banana Muffins","Muffins de Calabaza y Banana"
"Pumpkin Apple Protein Bars","Barras de Proteína de Calabaza y Manzana"
"Pumpkin Pie Overnight Oats","Avena Nocturna de Pastel de Calabaza"
"Pumpkin Pie Smoothie","Batido de Pastel de Calabaza"
"Pumpkin Quiche with Quinoa Crust","Quiche de Calabaza con Corteza de Quinoa"
"Quinoa Oatmeal","Avena con Quinoa"
"Radish Toasts with Goat Cheese & Chives","Tostadas de Rábano con Queso de Cabra y Cebollín"
"Ricotta and Blackberry Jam Crostini","Crostini de Ricotta y Mermelada de Mora"
"Roasted Veggie Strata","Strata de Verduras Asadas"
"Sausage and Fresh Basil Fast Frittata","Frittata Rápida de Salchicha y Albahaca Fresca"
"Savory Asparagus Custards","Flanes Salados de Espárragos"
"Savory Crepes","Crepes Salados"
"Savory Mediterranean Oats","Avena Mediterránea Salada"
"Savory Tzatziki-Style Greek Yogurt","Yogur Griego Estilo Tzatziki Salado"
"Shakshuka","Shakshuka"
"Shakshuka with Red Peppers and Goat Cheese","Shakshuka con Pimientos Rojos y Queso de Cabra"
"Smoothie Breakfast Bowl","Tazón de Desayuno con Batido"
"Socca With Poached Eggs, Roasted Tomatoes, And Fresh Basil","Socca con Huevos Escalfados, Tomates Asados y Albahaca Fresca"
"Southwest Breakfast Quiche","Quiche de Desayuno del Suroeste"
"Speedy Shakshuka","Shakshuka Rápida"
"Spinach, Tomato and Feta Cheese Baked Egg","Huevo al Horno con Espinaca, Tomate y Queso Feta"
"Spinach and Parmesan Egg Bites","Bocaditos de Huevo con Espinaca y Parmesano"
"Spinach Mushroom Egg and Ham Cups","Tazas de Huevo, Champiñones, Espinaca y Jamón"
"Strawberry Cream Cheese French Toast Casserole","Cazuela de Tostadas Francesas con Fresas y Queso Crema"
"Strawberry Cream Cheese French Toast Casserole","Cazuela de Tostadas Francesas con Fresas y Queso Crema"
"Strawberry Stuffed French Toast","Tostadas Francesas Rellenas de Fresa"
"Strawberry Stuffed French Toast","Tostadas Francesas Rellenas de Fresa"
"Sugar Free Yogurt Parfait with Fresh Berries","Parfait de Yogur sin Azúcar con Frutas Frescas"
"Sugar Free Yogurt Parfait with Fresh Berries","Parfait de Yogur sin Azúcar con Frutas Frescas"
"Summer Fruit Smoothie","Batido de Frutas de Verano"
"Sunny Fried Egg and Avocado Taco","Taco de Huevo Frito al Estilo Sunny y Aguacate"
"Superfood Smoothie","Batido de Superalimentos"
"Sweet and Smoky Baked Eggs","Huevos al Horno Dulces y Ahumados"
"Sweet Onion Frittata with Ham","Frittata de Cebolla Dulce con Jamón"
"Sweet Potato Baskets with Eggs","Cestas de Batata con Huevos"
"Tomato Basil Frittata","Frittata de Tomate y Albahaca"
"Tropical Smoothie Bowl","Tazón de Batido Tropical"
"Turkey Sausage and Egg Casserole","Cazuela de Huevo y Salchicha de Pavo"
"Veggie Breakfast Wrap","Wrap de Desayuno con Verduras"
"Veggie Egg Fu Yung","Fu Yung de Huevo y Verduras"
"Whole-Wheat Spinach Parathas","Parathas de Espinaca Integral"
"Whole Grain Chicken and Waffles","Pollo y Waffles de Granos Enteros"
"Whole Wheat Breakfast Pizzas","Pizzas de Desayuno de Trigo Integral"
"Whole Wheat Sweet Potato Pancakes","Panqueques de Batata y Trigo Integral"
"Zucchini and Date Muffins","Muffins de Calabacín y Dátiles"
"Zucchini Egg Boats","Barcos de Huevo con Calabacín"
